question_type,gpt3.5_ans,gpt3.5_pts_earned,bard_ans,bard_pts_earned
s," Placing the new job at the front gives it higher priority but may disrupt the fairness
 among existing jobs. Placing it at the back maintains fairness but can delay the 
execution of the new job. ",10.0,"The subtle difference of putting a new job at the front of the RR queue
 versus the back does make a difference in the behavior of the RR 
scheduler.",0.0
s,"In summary, calling exec() before fork() in the UNIX shell results in the shell process
 being replaced by the new program, effectively terminating the shell itself. This change
 eliminates the creation of child processes and severs the relationship between the 
shell and the executed program. Consequently, the shell loses its ability to handle 
subsequent commands and interact with the user after executing the initial exec() call.",10.0,"The subtle difference of calling exec() before fork() will cause the shell
 to crash. This is because exec() replaces the current process image
 with the new process image, which means that the fork() call will not
 be able to create a new process.",10.0
s,"Shortening the time interval for moving jobs back to the top-most queue in the MLFQ
 policy improves responsiveness, fairness, and resource utilization. However, it may
 also increase context switching overhead and potentially introduce additional 
scheduling overhead.",8.5,"Shortening the value of the time interval between moving jobs back to
 the top-most queue will make the MLFQ scheduler more responsive.
 This is because it will allow jobs to move to the top-most queue more 
quickly, which will give them a chance to run sooner.

However, shortening the value of the time interval will also make the 
MLFQ scheduler less fair. This is because it will give jobs that are already
 running an unfair advantage over jobs that are waiting in the queue.",5.0
s,"Using a simplified random number generator with a fixed sequence of numbers in 
the lottery scheduler eliminates true randomness, leading to deterministic behavior,
 repetitive scheduling patterns, and unfair resource distribution. The scheduler loses
 its ability to adapt to changing conditions and may result in reduced fairness and 
efficiency in resource allocation.",10.0,"The subtle difference of using a simplified random number generator
 will make the lottery scheduler less fair. This is because the simplified 
random number generator is more likely to pick certain numbers than others.",10.0
s,"The shift from a time-based to a TLB miss-based interrupt alters the triggering 
mechanism of the interrupt and its usefulness. While it improves responsiveness 
to TLB misses and allows for efficient handling of memory access inefficiencies,
 it introduces challenges related to time predictability and coordination with other 
time-dependent operations.",6.5,"Making the timer interrupt based on the number of TLB misses rather
 than on time will make the timer interrupt less useful. This is because
 the number of TLB misses will vary depending on the workload of the system.",10.0
s,"The absence of a valid bit in each TLB entry has implications for TLB efficiency, 
translation speed, the likelihood of page faults, accuracy of TLB entries, and TLB 
maintenance overhead. ",9.5,"The subtle difference of having a TLB without a valid bit will make the
 TLB less efficient. This is because the CPU will have to check every 
TLB entry, even if the entry is not valid.",10.0
s,"The lazy TLB update approach affects TLB utilization, TLB miss latency, TLB 
accuracy, translation overhead for infrequently accessed pages, and potential 
memory latency. While it may improve TLB accuracy by selectively caching 
translations based on access frequency, it can also lead to lower TLB utilization 
and increased translation overhead for infrequently accessed pages.",8.5,"The subtle difference of having a lazy TLB update will make the system
 less responsive. This is because the CPU will have to wait until the 
counter reaches 3 before the translation is installed in the TLB.",6.0
s,"The change in the base-and-bounds virtual memory system where the bounds
 register is checked only on writes has implications for data integrity, security, 
memory safety, performance, and risk of memory errors. While it provides protection
 against writes outside the allowed memory range, it lacks bounds checking on reads,
 potentially exposing the system to security vulnerabilities and memory-related errors.",9.0,"The subtle difference of checking the bounds register only on writes
 to memory will make the system less secure. This is because a 
malicious user could write to a memory location that is outside of 
the bounds of the process's address space.",7.5
s,"The change from a per-page reference bit to a per-page 32-bit counter in a page 
table provides more detailed information about page activity. It can potentially enhance 
page replacement decision-making by prioritizing less frequently accessed pages
 for eviction. However, it also introduces additional overhead, complexity, and memory usage.",10.0,"The subtle difference of making the per-page reference bit into a
 per-page 32-bit counter will make the page replacement algorithm 
more efficient. This is because the OS will be able to keep track of 
how often each page is being used, and it can use this information 
to decide which pages to replace.",8.0
s,"At this point, without the actual values of the PDE and PTE in the memory dump,
 I cannot determine the final physical memory address or the value loaded from the
 virtual address 0x1787. The values in the memory dump you provided seem to
 represent the content of physical memory, but they don't provide the necessary 
information to perform the translation accurately.",0.0,"The virtual address 0x1787 is valid and its physical address is 0x99.

he valid bit in the PDE at address 0x7300 is not set, so the page 
table entry for the virtual address 0x2665 is not located in memory.
 Therefore, the virtual address 0x2665 is not valid.",1.0
m,"VA 0x065 (decimal: 101) -> 0x1FD
VA 0x00C (decimal: 12) -> 0x3E
VA 0x026 (decimal: 38) -> 0x6A
VA 0x058 (decimal: 88) -> 0x1E8",1.0,"The virtual address 0x065 is valid and the physical address is 
0xFE00 + 0x65 = 0xFE65.
The virtual address 0x00c is not valid.
The virtual address 0x026 is valid and the physical address is 
0xFE00 + 0x26 = 0xFE26.
The virtual address 0x058 is not valid.",1.0
s,"Running processes on this subtly-changed virtual memory system would result in 
issues when accessing memory within segment 1, leading to incorrect memory 
mappings and potentially causing errors or data corruption.",10.0,"If the OS has been subtly changed to assume that the base register
 of segment 1 points to the last byte of the backwards-growing segment,
 then any accesses to addresses in segment 1 will be interpreted as
 accesses to addresses that are one byte less than their actual value.
 This will cause all accesses to segment 1 to fail",10.0
s,"The subtle change to the condition variable library affects the correctness of the 
producer/consumer solution by introducing the possibility of spurious wakeups, 
which can result in incorrect behavior and violate the expected synchronization 
constraints of the problem.",5.0,"The wait() function will no longer wake up a thread unless it has been
 signaled. This means that if the consumer thread calls wait() and 
there is no other thread that has signaled the fill condition variable,
 then the consumer thread will block forever.",3.0
s,"The new lock acquire() implementation with the additional spinning loop provides
 correct mutual exclusion but may introduce higher CPU usage due to the spinning 
behavior.",10.0,"The new lock acquire() will make the lock spin for a longer period of
 time before giving up. This is because the new lock acquire() will 
only give up if the lock is already held by another thread. The old 
lock acquire() would give up if the lock was held by another thread
 or if the lock was not available.

",8.0
cs,"The code provided has a potential race condition when multiple threads call the 
List_Insert function simultaneously. The problem lies in the line n->next = head; and
 head = n;, where the head pointer is updated concurrently without proper synchronization.

To fix the code and ensure correct thread safety, we need to use atomic operations 
or locks to protect the critical section where the head pointer is updated. One 
possible solution is to use a spin lock to provide mutual exclusion. 

typedef struct __node_t {
    int key;
    struct __node_t *next;
} node_t;

mutex_t m = PTHREAD_MUTEX_INITIALIZER;
node_t *head = NULL;

int List_Insert(int key) {
    node_t *n = malloc(sizeof(node_t));
    if (n == NULL) {
        return -1; // Failed to insert
    }
    n->key = key;
    n->next = NULL;

    mutex_lock(&m);

    // Critical section
    if (head == NULL) {
        head = n;
    } else {
        node_t *current = head;
        while (current->next != NULL) {
            current = current->next;
        }
        current->next = n;
    }

    mutex_unlock(&m);

    return 0;
}
",6.5,"int List_Insert(int key) {
  mutex_lock(&m);
  node_t *n = malloc(sizeof(node_t));
  if (n == NULL) {
    mutex_unlock(&m);
    return -1;
  }

  // Before assigning n->next to head, we need to make sure that
  // head is not modified by another thread in the meantime.
  node_t *tmp = head;
  n->key = key;
  n->next = tmp;
  head = n;

  mutex_unlock(&m);
  return 0;
}",10.0
